{
  "slug": "soumu-mobile-skip",
  "source_info": {
    "url": "",
    "title": "スマートフォンを安心して利用するために実施されるべき方策",
    "retrieved_at": "2025-09-24T12:12:57.781Z"
  },
  "extraction_meta": {
    "success": false,
    "method": "text",
    "skipped_reason": "スキップ指定またはURL未指定"
  },
  "content": {
    "full_text": "",
    "text": ""
  }
}