{
  "slug": "一般財団法人から入手",
  "source_info": {
    "url": "",
    "title": "JIS Q 15001:2017 対応　個人情報保護マネジメントシステム導入・実践ガイドブック　第 2 版",
    "retrieved_at": "2025-09-24T12:12:25.964Z"
  },
  "extraction_meta": {
    "success": false,
    "method": "text",
    "skipped_reason": "スキップ指定またはURL未指定"
  },
  "content": {
    "full_text": "",
    "text": ""
  }
}