{
  "slug": "meti-security",
  "source_info": {
    "url": "http://www.meti.go.jp/policy/netsecurity/downloadfiles/esecu03j.pdf",
    "title": "情報システム安全対策基準",
    "retrieved_at": "2025-09-24T12:12:37.808Z",
    "etag": "\"db70-5dd0f7b537191\"",
    "last_modified": "Wed, 20 Apr 2022 05:44:06 GMT",
    "content_type": "application/pdf",
    "file_size": 56176,
    "checksum": "6fbf092c055aaab3"
  },
  "extraction_meta": {
    "success": true,
    "method": "pdf",
    "total_pages": 16,
    "extracted_pages": 16,
    "warnings": []
  },
  "content": {
    "full_text": "\n\n\n\n\n\n\n\n\n\n\n\n\n\n\n\n\n\n\n\n\n\n\n\n\n\n\n\n\n\n\n\n\n\n\n\n\n\n\n\n\n\n\n\n\n\n\n\n\n\n\n\n\n\n\n\n\n\n\n\n\n\n\n\n\n\n\n\n\n\n\n\n\n\n\n\n\n\n\n\n\n\n\n\n\n\n\n\n\n\n\n\n\n\n\n\n\n\n\n\n\n\n\n\n\n\n\n\n\n\n\n\n\n\n\n\n\n\n\n\n\n\n\n\n\n\n\n\n\n\n\n\n\n\n\n\n\n\n\n\n\n\n\n\n\n\n\n\n\n\n\n\n\n\n\n\n\n\n\n\n\n\n\n\n\n\n\n\n\n\n\n\n\n\n\n\n\n\n\n\n\n\n\n\n\n\n\n\n\n\n\n\n\n\n\n\n\n\n\n\n\n\n\n\n\n\n\n\n\n\n\n\n\n\n\n\n\n\n\n\n\n\n\n\n\n\n\n\n\n\n\n\n\n\n\n\n\n\n\n\n\n\n\n\n\n\n\n\n\n\n\n\n\n\n\n\n\n\n\n\n\n\n\n\n\n\n\n\n\n\n\n\n\n\n\n\n\n\n\n\n\n\n\n\n\n\n\n\n\n\n\n\n\n\n\n\n\n\n\n\n\n\n\n\n\n\n\n\n\n\n\n\n\n\n\n\n\n\n\n\n\n\n\n\n\n\n\n\n\n\n\n\n\n\n\n\n\n\n\n\n\n\n\n\n\n\n\n\n\n\n\n\n\n\n\n\n\n\n\n\n\n\n\n\n\n\n\n\n\n\n\n\n\n\n\n\n\n\n\n\n\n\n\n\n\n\n\n\n\n\n\n\n\n\n\n\n\n\n\n\n\n\n\n\n\n\n\n\n\n\n\n\n\n\n\n\n\n\n\n\n\n\n\n\n\n\n\n\n\n\n\n\n\n\n\n\n\n\n\n\n\n\n\n\n\n\n\n\n\n\n\n\n\n\n\n\n\n\n\n\n\n\n\n\n\n\n\n\n\n\n\n\n\n\n\n\n\n\n\n\n\n\n\n\n\n\n\n\n\n\n\n\n\n\n\n\n\n\n\n\n\n\n\n\n\n\n\n\n\n\n\n\n\n\n\n\n\n\n\n\n\n\n\n\n\n\n\n\n\n\n\n\n\n\n\n\n\n\n\n\n\n\n\n\n\n\n\n\n\n\n\n\n\n\n\n\n\n\n\n\n\n\n\n\n\n",
    "metadata": {
      "info": {
        "PDFFormatVersion": "1.2",
        "IsAcroFormPresent": false,
        "IsXFAPresent": false,
        "Title": "Taro9-安全基準（その１）.PDF",
        "Author": "OJAA0426",
        "Creator": "一太郎 - [安全基準（その１）.jtd]",
        "Producer": "Acrobat PDFWriter 3.03 for Windows NT",
        "CreationDate": "D:20000418105234",
        "ModDate": "D:20000419101842"
      },
      "metadata": null,
      "version": "1.10.100"
    }
  }
}