{
  "slug": "jis-q15001",
  "source_info": {
    "url": "",
    "title": "個人情報保護マネジメントシステム－要求事項―",
    "retrieved_at": "2025-09-24T12:12:24.952Z"
  },
  "extraction_meta": {
    "success": false,
    "method": "text",
    "skipped_reason": "スキップ指定またはURL未指定"
  },
  "content": {
    "full_text": "",
    "text": ""
  }
}